{
  "format_version": 1,
  "name": "Malware Detected Then Security Log Cleared",
  "description": "Microsoft Defender reports a detection (1116) and the security audit log is then cleared (1102) — someone reacting to being caught rather than remediating. 1116 comes from the Defender operational channel, which must be ingested alongside the Security log for this rule to match.",
  "relation_type": "correlation",
  "algorithm": "sequence",
  "channels": ["Microsoft-Windows-Windows Defender/Operational", "Security"],
  "sequence": ["1116", "1102"],
  "labels": ["then clears the audit log"]
}
