{
  "format_version": 1,
  "name": "Password Reset Then Logon",
  "description": "An account password is reset by an administrator (4724) and a logon follows (4624) — legitimate during helpdesk work, notable when the reset was not requested.",
  "relation_type": "correlation",
  "algorithm": "sequence",
  "channels": ["Security"],
  "sequence": ["4724", "4624"],
  "labels": ["then logs on"]
}
